[
  {
    "id": "capitec-snappi-extra-15-percent",
    "slug": "capitec-snappi-extra-15-percent",
    "type": "coupon",
    "brand": "Capitec",
    "brandSlug": "capitec",
    "title": "Extra 15% off at Snappi with Capitec Live Better",
    "summary": "Capitec Live Better clients can use CAPITEC15 for an extra 15% off already discounted items at Snappi.",
    "couponCode": "CAPITEC15",
    "destinationUrl": "https://getsnappi.com/",
    "sourceUrl": "https://www.capitecbank.co.za/rewards/spend-better/snappi/",
    "category": "banking-rewards",
    "lastChecked": "2026-09-09",
    "reviewDueAt": "2026-09-16",
    "terms": "Capitec says the code is limited to one voucher per person per month, applies to one sitewide purchase excluding liquor, and has no minimum spend. A Snappi account is required.",
    "publicationStatus": "published",
    "verificationStatus": "verified",
    "country": "ZA",
    "affiliate": false,
    "sponsored": false,
    "publishedAt": "2026-08-07",
    "updatedAt": "2026-09-09"
  },
  {
    "id": "capitec-anew-hotels-livebetter-discount",
    "slug": "capitec-anew-hotels-livebetter-discount",
    "type": "coupon",
    "brand": "Capitec",
    "brandSlug": "capitec",
    "title": "25% or 30% off ANEW Hotels stays for Capitec clients",
    "summary": "Use LIVEBETTER when checking availability at selected ANEW Hotels, then pay with a qualifying Capitec card.",
    "couponCode": "LIVEBETTER",
    "destinationUrl": "https://anewhotels.com/",
    "sourceUrl": "https://www.capitecbank.co.za/rewards/spend-better/anew/",
    "category": "travel",
    "startsAt": "2024-06-01",
    "expiresAt": "2026-12-31",
    "lastChecked": "2026-08-07",
    "reviewDueAt": "2026-08-21",
    "terms": "The official Capitec page states 25% off when paying with a Debit Card, or 30% off plus DragonPass access when spending at least R1,500 with a Credit Card. Selected hotels, a minimum two-night stay, direct booking, availability and other rate conditions apply.",
    "publicationStatus": "published",
    "verificationStatus": "verified",
    "country": "ZA",
    "affiliate": false,
    "sponsored": false,
    "publishedAt": "2026-08-07",
    "updatedAt": "2026-08-07"
  },
  {
    "id": "g-adventures-south-africa-selected-tours-15-percent",
    "slug": "g-adventures-south-africa-selected-tours-15-percent",
    "type": "coupon",
    "brand": "G Adventures",
    "brandSlug": "g-adventures",
    "title": "15% off selected South Africa tour departures",
    "summary": "G Adventures lists 15% off selected South Africa departures with promo code G26SDQ015SAF03.",
    "couponCode": "G26SDQ015SAF03",
    "destinationUrl": "https://www.gadventures.com/trips/journeys-explore-southern-africa/DSLNG/",
    "sourceUrl": "https://www.gadventures.com/trips/journeys-explore-southern-africa/DSLNG/",
    "category": "travel",
    "expiresAt": "2026-08-11",
    "lastChecked": "2026-08-07",
    "reviewDueAt": "2026-08-11",
    "terms": "The official trip page shows the code for selected departures from 22 October to 29 November 2026. Prices, eligible dates and availability vary. Confirm the discount before paying.",
    "publicationStatus": "published",
    "verificationStatus": "verified",
    "country": "ZA",
    "affiliate": false,
    "sponsored": false,
    "publishedAt": "2026-08-07",
    "updatedAt": "2026-08-07"
  },
  {
    "id": "capitec-dress-your-tech-25-percent",
    "slug": "capitec-dress-your-tech-25-percent",
    "type": "deal",
    "brand": "Capitec",
    "brandSlug": "capitec",
    "title": "25% off Dress Your Tech accessories for Capitec clients",
    "summary": "Eligible Capitec Live Better clients receive 25% off through the Dress Your Tech offer in the Capitec app.",
    "destinationUrl": "https://www.capitecbank.co.za/rewards/spend-better/dress-your-tech/",
    "sourceUrl": "https://www.capitecbank.co.za/rewards/spend-better/dress-your-tech/",
    "termsUrl": "https://www.capitecbank.co.za/globalassets/pages/competition-and-conditions/live-better-benefits/2024/240418-capitec-and-dress-your-tech-deal-rules2.pdf",
    "category": "electronics-appliances",
    "startsAt": "2024-04-01",
    "lastChecked": "2026-08-07",
    "reviewDueAt": "2026-08-21",
    "terms": "No code or minimum spend is stated. Eligible clients must open the offer through Cash back, deals and more in the Capitec app; the discount is applied automatically to the dedicated collection at checkout.",
    "publicationStatus": "published",
    "verificationStatus": "verified",
    "country": "ZA",
    "affiliate": false,
    "sponsored": false,
    "publishedAt": "2026-08-07",
    "updatedAt": "2026-08-07"
  },
  {
    "id": "capitec-spotify-three-months-free",
    "slug": "capitec-spotify-three-months-free",
    "type": "deal",
    "brand": "Capitec",
    "brandSlug": "capitec",
    "title": "Three months free Spotify Premium Standard for new listeners",
    "summary": "Capitec clients who are new Spotify listeners can claim three months of Spotify Premium Standard through the Capitec app.",
    "destinationUrl": "https://www.capitecbank.co.za/rewards/spend-better/spotify/",
    "sourceUrl": "https://www.capitecbank.co.za/rewards/spend-better/spotify/",
    "category": "entertainment",
    "expiresAt": "2028-01-07",
    "lastChecked": "2026-08-07",
    "reviewDueAt": "2026-08-21",
    "terms": "For new Spotify listeners using a Capitec Debit or Credit Card. Claim through the Capitec app. The voucher lasts three months from issue and the paid subscription starts automatically afterward unless cancelled. The official redemption deadline is 7 January 2028.",
    "publicationStatus": "published",
    "verificationStatus": "verified",
    "country": "ZA",
    "affiliate": false,
    "sponsored": false,
    "publishedAt": "2026-08-07",
    "updatedAt": "2026-08-07"
  },
  {
    "id": "capitec-dis-chem-selected-brands-15-percent",
    "slug": "capitec-dis-chem-selected-brands-15-percent",
    "type": "deal",
    "brand": "Capitec",
    "brandSlug": "capitec",
    "title": "15% instant discount on selected Dis-Chem brands",
    "summary": "Capitec clients can receive a 15% instant discount on more than 140 selected brands at Dis-Chem.",
    "destinationUrl": "https://www.capitecbank.co.za/rewards/",
    "sourceUrl": "https://www.capitecbank.co.za/were-here-to-help/faqs/?selectQuestionSection=Vouchers",
    "category": "beauty-health",
    "startsAt": "2025-10-21",
    "lastChecked": "2026-08-07",
    "reviewDueAt": "2026-08-21",
    "terms": "Join Dis-Chem Better Rewards, link the card in the Capitec app, present the rewards card and pay with a Capitec Debit, Credit or Virtual Card. The fixed 15% discount applies only to qualifying brands and can stack with marked discounts.",
    "publicationStatus": "published",
    "verificationStatus": "verified",
    "country": "ZA",
    "affiliate": false,
    "sponsored": false,
    "publishedAt": "2026-08-07",
    "updatedAt": "2026-08-07"
  },
  {
    "id": "standard-bank-ucount-petshop-science-up-to-30-percent",
    "slug": "standard-bank-ucount-petshop-science-up-to-30-percent",
    "type": "deal",
    "brand": "Standard Bank UCount",
    "brandSlug": "standard-bank-ucount",
    "title": "Up to 30% back at Petshop Science with UCount",
    "summary": "Qualifying Standard Bank UCount members can earn up to 30% back in Rewards Points at Petshop Science stores.",
    "destinationUrl": "https://ucount.standardbank.co.za/personal/earn-points/how-to-earn-points/petshop-science/",
    "sourceUrl": "https://ucount.standardbank.co.za/personal/earn-points/how-to-earn-points/petshop-science/",
    "category": "pets",
    "lastChecked": "2026-08-07",
    "reviewDueAt": "2026-08-21",
    "terms": "The earn rate depends on UCount tier and card type. The top rate applies to qualifying Virtual Credit Card purchases. In-store purchases only, with an R500 spend cap per fixed cycle. Standard Bank and UCount eligibility rules apply.",
    "publicationStatus": "published",
    "verificationStatus": "verified",
    "country": "ZA",
    "affiliate": false,
    "sponsored": false,
    "publishedAt": "2026-08-07",
    "updatedAt": "2026-08-07"
  },
  {
    "id": "discovery-vitality-healthycare-up-to-50-percent",
    "slug": "discovery-vitality-healthycare-up-to-50-percent",
    "type": "deal",
    "brand": "Discovery Vitality",
    "brandSlug": "discovery-vitality",
    "title": "Up to 50% back on HealthyCare items",
    "summary": "Qualifying Discovery Vitality and Discovery Bank members can earn up to 50% back on HealthyCare products at Clicks or Dis-Chem.",
    "destinationUrl": "https://www.discovery.co.za/vitality/healthycare",
    "sourceUrl": "https://www.discovery.co.za/vitality/healthycare",
    "category": "beauty-health",
    "lastChecked": "2026-08-07",
    "reviewDueAt": "2026-08-21",
    "terms": "Activate HealthyCare and link the relevant Clicks ClubCard or Dis-Chem Better Rewards card. Vitality Health members can earn up to 25%; a qualifying Discovery Bank product and Vitality Money engagement can increase the total to 50%. Monthly spend thresholds, limits and qualifying-product rules apply.",
    "publicationStatus": "published",
    "verificationStatus": "verified",
    "country": "ZA",
    "affiliate": false,
    "sponsored": false,
    "publishedAt": "2026-08-07",
    "updatedAt": "2026-08-07"
  },
  {
    "id": "unionpay-south-africa-participating-merchants-discount",
    "slug": "unionpay-south-africa-participating-merchants-discount",
    "type": "deal",
    "brand": "UnionPay",
    "brandSlug": "unionpay",
    "title": "R50 to R150 off at participating South African merchants",
    "summary": "UnionPay cardholders can receive an instant discount of R50, R100 or R150 when meeting the qualifying spend at participating merchants.",
    "destinationUrl": "https://www.unionpayintl.com/cardholderServ/serviceCenter/merchant/11752423310187?type=1",